{
  "formatVersion": 1,
  "id": "consumer-sdd-reference",
  "architecture": "spec-driven-development",
  "executable": false,
  "stages": [
    {
      "id": "captured",
      "skillRefs": [],
      "templateRefs": [],
      "guideRefs": [
        ".exphere/guides/execution.md"
      ],
      "checkIds": [],
      "requiredEvidence": [
        "scope-evidence"
      ]
    },
    {
      "id": "discovery",
      "skillRefs": [],
      "templateRefs": [],
      "guideRefs": [
        ".exphere/guides/execution.md"
      ],
      "checkIds": [],
      "requiredEvidence": [
        "scope-evidence"
      ]
    },
    {
      "id": "proposed",
      "skillRefs": [],
      "templateRefs": [],
      "guideRefs": [
        ".exphere/guides/execution.md"
      ],
      "checkIds": [],
      "requiredEvidence": [
        "scope-evidence"
      ]
    },
    {
      "id": "specified",
      "skillRefs": [
        ".exphere/skills/review-plan/SKILL.md"
      ],
      "templateRefs": [
        ".exphere/guides/templates/spec.md"
      ],
      "guideRefs": [
        ".exphere/guides/execution.md"
      ],
      "checkIds": [],
      "requiredEvidence": [
        "scope-evidence"
      ]
    },
    {
      "id": "ready",
      "skillRefs": [],
      "templateRefs": [],
      "guideRefs": [
        ".exphere/guides/execution.md"
      ],
      "checkIds": [
        "resource-preflight",
        "financial-admission"
      ],
      "requiredEvidence": [
        "scope-evidence"
      ]
    },
    {
      "id": "implementing",
      "skillRefs": [],
      "templateRefs": [],
      "guideRefs": [
        ".exphere/guides/execution.md"
      ],
      "checkIds": [],
      "requiredEvidence": [
        "scope-evidence"
      ]
    },
    {
      "id": "verifying",
      "skillRefs": [
        ".exphere/skills/review-plan/SKILL.md"
      ],
      "templateRefs": [
        ".exphere/guides/templates/verification.md"
      ],
      "guideRefs": [
        ".exphere/guides/execution.md"
      ],
      "checkIds": [
        "outcome-review"
      ],
      "requiredEvidence": [
        "verification-evidence"
      ]
    },
    {
      "id": "delivery-approved",
      "skillRefs": [],
      "templateRefs": [],
      "guideRefs": [
        ".exphere/guides/execution.md"
      ],
      "checkIds": [],
      "requiredEvidence": [
        "scope-evidence"
      ]
    },
    {
      "id": "observing",
      "skillRefs": [],
      "templateRefs": [],
      "guideRefs": [
        ".exphere/guides/execution.md"
      ],
      "checkIds": [],
      "requiredEvidence": [
        "verification-evidence"
      ]
    },
    {
      "id": "reviewed",
      "skillRefs": [],
      "templateRefs": [],
      "guideRefs": [
        ".exphere/guides/execution.md"
      ],
      "checkIds": [],
      "requiredEvidence": [
        "scope-evidence"
      ]
    }
  ],
  "transitions": [
    {
      "from": "captured",
      "to": "discovery"
    },
    {
      "from": "discovery",
      "to": "proposed"
    },
    {
      "from": "proposed",
      "to": "specified"
    },
    {
      "from": "specified",
      "to": "ready"
    },
    {
      "from": "ready",
      "to": "implementing"
    },
    {
      "from": "implementing",
      "to": "verifying"
    },
    {
      "from": "verifying",
      "to": "delivery-approved"
    },
    {
      "from": "delivery-approved",
      "to": "observing"
    },
    {
      "from": "observing",
      "to": "reviewed"
    },
    {
      "from": "verifying",
      "to": "implementing",
      "reason": "verification-failed"
    },
    {
      "from": "verifying",
      "to": "specified",
      "reason": "scope-changed"
    }
  ],
  "blocking": {
    "preserveStage": true,
    "requires": [
      "reason",
      "resumeCondition"
    ]
  }
}
